[I 2025-09-03 09:32:03,746] Trial 49 finished with value: 0.8591210114388922 and parameters: {'C': 68.04435470983414, 'solver': 'saga'}. Best is trial 21 with value: 0.8609271523178808.
Traceback (most recent call last):
  File "/remote-home/cs_acmis_xyt/dsAgent/development/workspace/20250902-120218/05_obesity_CVD_risk/train.py", line 78, in <module>
    y_test_pred = predict(best_model, X_test, scaler)
NameError: name 'predict' is not defined

==================================================:
===================生成的代码========================:
import pandas as pd
from sklearn.metrics import accuracy_score
import numpy as np
import random
import torch
from sklearn.model_selection import train_test_split
from sklearn.preprocessing import StandardScaler, LabelEncoder
from sklearn.linear_model import LogisticRegression
from submission import submit_predictions_for_test_set
import optuna

SEED = 42
random.seed(SEED)
torch.manual_seed(SEED)
np.random.seed(SEED)

def compute_metrics(y_test, y_test_pred):
    score = accuracy_score(y_test, y_test_pred)
    return score

def preprocess_data(X):
    # Convert categorical columns to numeric
    le = LabelEncoder()
    for col in X.select_dtypes(include=['object']).columns:
        X[col] = le.fit_transform(X[col])
    return X

def predict(model, X, scaler):
    # Preprocess the data
    X = preprocess_data(X)
    
    # Standardize the features
    X_scaled = scaler.transform(X)
    
    # Predict the model
    y_pred = model.predict(X_scaled)
    return y_pred

def objective(trial):
    # Define the hyperparameters to tune
    C = trial.suggest_float('C', 1e-4, 1e4, log=True)
    solver = trial.suggest_categorical('solver', ['newton-cg', 'lbfgs', 'liblinear', 'sag', 'saga'])
    
    # Define and train the logistic regression model with the suggested hyperparameters
    model = LogisticRegression(C=C, solver=solver, random_state=SEED)
    model.fit(X_train_scaled, y_train)
    
    # Evaluate the model on the validation set
    y_valid_pred = model.predict(X_valid_scaled)
    score = compute_metrics(y_valid, y_valid_pred)
    
    return score

if __name__ == '__main__':
    # Load the data
    data_df = pd.read_csv('train.csv')
    X = data_df.drop(['NObeyesdad'], axis=1)
    y = data_df['NObeyesdad'].to_numpy()
    
    # Split the data
    X_train, X_valid, y_train, y_valid = train_test_split(X, y, test_size=0.10, random_state=SEED)
    
    # Preprocess the data
    X_train = preprocess_data(X_train)
    X_valid = preprocess_data(X_valid)
    
    # Standardize the features
    scaler = StandardScaler()
    X_train_scaled = scaler.fit_transform(X_train)
    X_valid_scaled = scaler.transform(X_valid)
    
    # Perform hyperparameter tuning using Optuna
    study = optuna.create_study(direction='maximize')
    study.optimize(objective, n_trials=50)
    
    # Get the best hyperparameters
    best_params = study.best_params
    best_model = LogisticRegression(C=best_params['C'], solver=best_params['solver'], random_state=SEED)
    best_model.fit(X_train_scaled, y_train)
    
    # Evaluate the best model on the validation set
    y_valid_pred = best_model.predict(X_valid_scaled)
    score = compute_metrics(y_valid, y_valid_pred)
    print("Best model accuracy on validation set: ", score)
    
    # Submit predictions for the test set
    submission_df = pd.read_csv('test.csv')
    X_test = submission_df.drop(['NObeyesdad'], axis=1)
    y_test_pred = predict(best_model, X_test, scaler)
    submit_predictions_for_test_set(y_test_pred)
==================================================:
===================执行结果========================:
The script has been executed. Here is the output:
Best model accuracy on validation set:  0.8609271523178808
Final accuracy on test set:  0.8648843930635838

==================================================:
===================任务执行结束========================:
异常类型: ValueError
异常消息: too many values to unpack (expected 2)
堆栈跟踪信息:
Traceback (most recent call last):
  File "/remote-home/cs_acmis_xyt/dsAgent/development/MLAgentBench/run_nl2workflow.py", line 165, in <module>
    run(getattr(sys.modules[__name__], args.agent_type), args)
  File "/remote-home/cs_acmis_xyt/dsAgent/development/MLAgentBench/run_nl2workflow.py", line 39, in run
    final_message = agent.run(env)
  File "/remote-home/cs_acmis_xyt/dsAgent/development/MLAgentBench/agents/dsagent.py", line 52, in run
    execution_log, diff = env.execute(Action(action, action_input))
ValueError: too many values to unpack (expected 2)
==================================================
