===================生成的代码========================:
import pandas as pd
from sklearn.metrics import accuracy_score
import numpy as np
import random
import torch
from sklearn.model_selection import train_test_split
from sklearn.preprocessing import StandardScaler
from sklearn.linear_model import LogisticRegression
from submission import submit_predictions_for_test_set

SEED = 42
random.seed(SEED)
torch.manual_seed(SEED)
np.random.seed(SEED)

def compute_metrics(y_test, y_test_pred):
    score = accuracy_score(y_test, y_test_pred)
    return score

def train_model(X_train, y_train, X_valid, y_valid):
    # Standardize the features
    scaler = StandardScaler()
    X_train_scaled = scaler.fit_transform(X_train)
    X_valid_scaled = scaler.transform(X_valid)
    
    # Define and train the logistic regression model
    model = LogisticRegression(random_state=SEED)
    model.fit(X_train_scaled, y_train)
    
    return model, scaler

def predict(model, X, scaler):
    # Standardize the features
    X_scaled = scaler.transform(X)
    
    # Predict the model
    y_pred = model.predict(X_scaled)
    return y_pred

if __name__ == '__main__':
    data_df = pd.read_csv('train.csv')

    X = data_df.drop(['NObeyesdad'], axis=1)
    y = data_df['NObeyesdad'].to_numpy()

    # Apply preprocessing
    X_train, X_valid, y_train, y_valid = train_test_split(X, y, test_size=0.10, random_state=SEED)

    # Define and train the model
    model, scaler = train_model(X_train, y_train, X_valid, y_valid)

    # Evaluate the model on the valid set using compute_metrics and print the results
    y_valid_pred = predict(model, X_valid, scaler)
    score = compute_metrics(y_valid, y_valid_pred)
    print("Final accuracy on validation set: ", score)

    # Submit predictions for the test set
    submission_df = pd.read_csv('test.csv')
    X_test = submission_df.drop(['NObeyesdad'], axis=1)
    y_test_pred = predict(model, X_test, scaler)
    submit_predictions_for_test_set(y_test_pred)
==================================================:
===================执行结果========================:
The script has been executed. Here is the output:
Traceback (most recent call last):
  File "/remote-home/cs_acmis_xyt/dsAgent/development/workspace/20250902-120218/05_obesity_CVD_risk/train.py", line 50, in <module>
    model, scaler = train_model(X_train, y_train, X_valid, y_valid)
  File "/remote-home/cs_acmis_xyt/dsAgent/development/workspace/20250902-120218/05_obesity_CVD_risk/train.py", line 23, in train_model
    X_train_scaled = scaler.fit_transform(X_train)
  File "/remote-home/cs_acmis_xyt/dsAgent/envs/lib/python3.10/site-packages/sklearn/utils/_set_output.py", line 319, in wrapped
    data_to_wrap = f(self, X, *args, **kwargs)
  File "/remote-home/cs_acmis_xyt/dsAgent/envs/lib/python3.10/site-packages/sklearn/base.py", line 918, in fit_transform
    return self.fit(X, **fit_params).transform(X)
  File "/remote-home/cs_acmis_xyt/dsAgent/envs/lib/python3.10/site-packages/sklearn/preprocessing/_data.py", line 894, in fit
    return self.partial_fit(X, y, sample_weight)
  File "/remote-home/cs_acmis_xyt/dsAgent/envs/lib/python3.10/site-packages/sklearn/base.py", line 1389, in wrapper
    return fit_method(estimator, *args, **kwargs)
  File "/remote-home/cs_acmis_xyt/dsAgent/envs/lib/python3.10/site-packages/sklearn/preprocessing/_data.py", line 930, in partial_fit
    X = validate_data(
  File "/remote-home/cs_acmis_xyt/dsAgent/envs/lib/python3.10/site-packages/sklearn/utils/validation.py", line 2944, in validate_data
    out = check_array(X, input_name="X", **check_params)
  File "/remote-home/cs_acmis_xyt/dsAgent/envs/lib/python3.10/site-packages/sklearn/utils/validation.py", line 1055, in check_array
    array = _asarray_with_order(array, order=order, dtype=dtype, xp=xp)
  File "/remote-home/cs_acmis_xyt/dsAgent/envs/lib/python3.10/site-packages/sklearn/utils/_array_api.py", line 839, in _asarray_with_order
    array = numpy.asarray(array, order=order, dtype=dtype)
  File "/remote-home/cs_acmis_xyt/dsAgent/envs/lib/python3.10/site-packages/pandas/core/generic.py", line 2153, in __array__
    arr = np.asarray(values, dtype=dtype)
ValueError: could not convert string to float: 'Female'

==================================================:
===================生成的代码========================:
import pandas as pd
from sklearn.metrics import accuracy_score
import numpy as np
import random
import torch
from sklearn.model_selection import train_test_split
from sklearn.preprocessing import StandardScaler, LabelEncoder
from sklearn.linear_model import LogisticRegression
from submission import submit_predictions_for_test_set

SEED = 42
random.seed(SEED)
torch.manual_seed(SEED)
np.random.seed(SEED)

def compute_metrics(y_test, y_test_pred):
    score = accuracy_score(y_test, y_test_pred)
    return score

def preprocess_data(X):
    # Convert categorical columns to numeric
    le = LabelEncoder()
    for col in X.select_dtypes(include=['object']).columns:
        X[col] = le.fit_transform(X[col])
    return X

def train_model(X_train, y_train, X_valid, y_valid):
    # Preprocess the data
    X_train = preprocess_data(X_train)
    X_valid = preprocess_data(X_valid)
    
    # Standardize the features
    scaler = StandardScaler()
    X_train_scaled = scaler.fit_transform(X_train)
    X_valid_scaled = scaler.transform(X_valid)
    
    # Define and train the logistic regression model
    model = LogisticRegression(random_state=SEED)
    model.fit(X_train_scaled, y_train)
    
    return model, scaler

def predict(model, X, scaler):
    # Preprocess the data
    X = preprocess_data(X)
    
    # Standardize the features
    X_scaled = scaler.transform(X)
    
    # Predict the model
    y_pred = model.predict(X_scaled)
    return y_pred

if __name__ == '__main__':
    data_df = pd.read_csv('train.csv')

    X = data_df.drop(['NObeyesdad'], axis=1)
    y = data_df['NObeyesdad'].to_numpy()

    # Apply preprocessing
    X_train, X_valid, y_train, y_valid = train_test_split(X, y, test_size=0.10, random_state=SEED)

    # Define and train the model
    model, scaler = train_model(X_train, y_train, X_valid, y_valid)

    # Evaluate the model on the valid set using compute_metrics and print the results
    y_valid_pred = predict(model, X_valid, scaler)
    score = compute_metrics(y_valid, y_valid_pred)
    print("Final accuracy on validation set: ", score)

    # Submit predictions for the test set
    submission_df = pd.read_csv('test.csv')
    X_test = submission_df.drop(['NObeyesdad'], axis=1)
    y_test_pred = predict(model, X_test, scaler)
    submit_predictions_for_test_set(y_test_pred)
==================================================:
===================执行结果========================:
The script has been executed. Here is the output:
Final accuracy on validation set:  0.856110776640578
Final accuracy on test set:  0.8619942196531792

==================================================:
===================生成的代码========================:
import pandas as pd
from sklearn.metrics import accuracy_score
import numpy as np
import random
import torch
from sklearn.model_selection import train_test_split
from sklearn.preprocessing import StandardScaler, LabelEncoder
from sklearn.linear_model import LogisticRegression
from submission import submit_predictions_for_test_set
import optuna

SEED = 42
random.seed(SEED)
torch.manual_seed(SEED)
np.random.seed(SEED)

def compute_metrics(y_test, y_test_pred):
    score = accuracy_score(y_test, y_test_pred)
    return score

def preprocess_data(X):
    # Convert categorical columns to numeric
    le = LabelEncoder()
    for col in X.select_dtypes(include=['object']).columns:
        X[col] = le.fit_transform(X[col])
    return X

def objective(trial):
    # Define the hyperparameters to tune
    C = trial.suggest_loguniform('C', 1e-4, 1e4)
    solver = trial.suggest_categorical('solver', ['newton-cg', 'lbfgs', 'liblinear', 'sag', 'saga'])
    
    # Define and train the logistic regression model with the suggested hyperparameters
    model = LogisticRegression(C=C, solver=solver, random_state=SEED)
    model.fit(X_train_scaled, y_train)
    
    # Evaluate the model on the validation set
    y_valid_pred = model.predict(X_valid_scaled)
    score = compute_metrics(y_valid, y_valid_pred)
    
    return score

if __name__ == '__main__':
    # Load the data
    data_df = pd.read_csv('train.csv')
    X = data_df.drop(['NObeyesdad'], axis=1)
    y = data_df['NObeyesdad'].to_numpy()
    
    # Split the data
    X_train, X_valid, y_train, y_valid = train_test_split(X, y, test_size=0.10, random_state=SEED)
    
    # Preprocess the data
    X_train = preprocess_data(X_train)
    X_valid = preprocess_data(X_valid)
    
    # Standardize the features
    scaler = StandardScaler()
    X_train_scaled = scaler.fit_transform(X_train)
    X_valid_scaled = scaler.transform(X_valid)
    
    # Perform hyperparameter tuning using Optuna
    study = optuna.create_study(direction='maximize')
    study.optimize(objective, n_trials=50)
    
    # Get the best hyperparameters
    best_params = study.best_params
    best_model = LogisticRegression(C=best_params['C'], solver=best_params['solver'], random_state=SEED)
    best_model.fit(X_train_scaled, y_train)
    
    # Evaluate the best model on the validation set
    y_valid_pred = best_model.predict(X_valid_scaled)
    score = compute_metrics(y_valid, y_valid_pred)
    print("Best model accuracy on validation set: ", score)
    
    # Submit predictions for the test set
    submission_df = pd.read_csv('test.csv')
    X_test = submission_df.drop(['NObeyesdad'], axis=1)
    y_test_pred = predict(best_model, X_test, scaler)
    submit_predictions_for_test_set(y_test_pred)
==================================================:
===================执行结果========================:
The script has been executed. Here is the output:
[I 2025-09-03 09:31:37,101] A new study created in memory with name: no-name-9054a613-45e2-4658-9f48-fb2b06d166cf
/remote-home/cs_acmis_xyt/dsAgent/development/workspace/20250902-120218/05_obesity_CVD_risk/train.py:30: FutureWarning: suggest_loguniform has been deprecated in v3.0.0. This feature will be removed in v6.0.0. See https://github.com/optuna/optuna/releases/tag/v3.0.0. Use suggest_float(..., log=True) instead.
  C = trial.suggest_loguniform('C', 1e-4, 1e4)
/remote-home/cs_acmis_xyt/dsAgent/envs/lib/python3.10/site-packages/sklearn/linear_model/_sag.py:348: ConvergenceWarning: The max_iter was reached which means the coef_ did not converge
  warnings.warn(
[I 2025-09-03 09:31:38,028] Trial 0 finished with value: 0.8603251053582179 and parameters: {'C': 3680.0527783933353, 'solver': 'sag'}. Best is trial 0 with value: 0.8603251053582179.
/remote-home/cs_acmis_xyt/dsAgent/development/workspace/20250902-120218/05_obesity_CVD_risk/train.py:30: FutureWarning: suggest_loguniform has been deprecated in v3.0.0. This feature will be removed in v6.0.0. See https://github.com/optuna/optuna/releases/tag/v3.0.0. Use suggest_float(..., log=True) instead.
  C = trial.suggest_loguniform('C', 1e-4, 1e4)
/remote-home/cs_acmis_xyt/dsAgent/envs/lib/python3.10/site-packages/sklearn/linear_model/_sag.py:348: ConvergenceWarning: The max_iter was reached which means the coef_ did not converge
  warnings.warn(
[I 2025-09-03 09:31:39,005] Trial 1 finished with value: 0.8597230583985551 and parameters: {'C': 203.73512434320043, 'solver': 'saga'}. Best is trial 0 with value: 0.8603251053582179.
/remote-home/cs_acmis_xyt/dsAgent/development/workspace/20250902-120218/05_obesity_CVD_risk/train.py:30: FutureWarning: suggest_loguniform has been deprecated in v3.0.0. This feature will be removed in v6.0.0. See https://github.com/optuna/optuna/releases/tag/v3.0.0. Use suggest_float(..., log=True) instead.
  C = trial.suggest_loguniform('C', 1e-4, 1e4)
/remote-home/cs_acmis_xyt/dsAgent/envs/lib/python3.10/site-packages/sklearn/linear_model/_sag.py:348: ConvergenceWarning: The max_iter was reached which means the coef_ did not converge
  warnings.warn(
[I 2025-09-03 09:31:39,916] Trial 2 finished with value: 0.8603251053582179 and parameters: {'C': 49.24692422290739, 'solver': 'sag'}. Best is trial 0 with value: 0.8603251053582179.
/remote-home/cs_acmis_xyt/dsAgent/development/workspace/20250902-120218/05_obesity_CVD_risk/train.py:30: FutureWarning: suggest_loguniform has been deprecated in v3.0.0. This feature will be removed in v6.0.0. See https://github.com/optuna/optuna/releases/tag/v3.0.0. Use suggest_float(..., log=True) instead.
  C = trial.suggest_loguniform('C', 1e-4, 1e4)
[I 2025-09-03 09:31:40,398] Trial 3 finished with value: 0.8603251053582179 and parameters: {'C': 1116.6462712980763, 'solver': 'newton-cg'}. Best is trial 0 with value: 0.8603251053582179.
/remote-home/cs_acmis_xyt/dsAgent/development/workspace/20250902-120218/05_obesity_CVD_risk/train.py:30: FutureWarning: suggest_loguniform has been deprecated in v3.0.0. This feature will be removed in v6.0.0. See https://github.com/optuna/optuna/releases/tag/v3.0.0. Use suggest_float(..., log=True) instead.
  C = trial.suggest_loguniform('C', 1e-4, 1e4)
[I 2025-09-03 09:31:40,846] Trial 4 finished with value: 0.8591210114388922 and parameters: {'C': 7.840385642052292, 'solver': 'newton-cg'}. Best is trial 0 with value: 0.8603251053582179.
/remote-home/cs_acmis_xyt/dsAgent/development/workspace/20250902-120218/05_obesity_CVD_risk/train.py:30: FutureWarning: suggest_loguniform has been deprecated in v3.0.0. This feature will be removed in v6.0.0. See https://github.com/optuna/optuna/releases/tag/v3.0.0. Use suggest_float(..., log=True) instead.
  C = trial.suggest_loguniform('C', 1e-4, 1e4)
/remote-home/cs_acmis_xyt/dsAgent/envs/lib/python3.10/site-packages/sklearn/linear_model/_logistic.py:465: ConvergenceWarning: lbfgs failed to converge (status=1):
STOP: TOTAL NO. OF ITERATIONS REACHED LIMIT.

Increase the number of iterations (max_iter) or scale the data as shown in:
    https://scikit-learn.org/stable/modules/preprocessing.html
Please also refer to the documentation for alternative solver options:
    https://scikit-learn.org/stable/modules/linear_model.html#logistic-regression
  n_iter_i = _check_optimize_result(
[I 2025-09-03 09:31:41,129] Trial 5 finished with value: 0.8591210114388922 and parameters: {'C': 12.255425520341264, 'solver': 'lbfgs'}. Best is trial 0 with value: 0.8603251053582179.
/remote-home/cs_acmis_xyt/dsAgent/development/workspace/20250902-120218/05_obesity_CVD_risk/train.py:30: FutureWarning: suggest_loguniform has been deprecated in v3.0.0. This feature will be removed in v6.0.0. See https://github.com/optuna/optuna/releases/tag/v3.0.0. Use suggest_float(..., log=True) instead.
  C = trial.suggest_loguniform('C', 1e-4, 1e4)
[I 2025-09-03 09:31:41,331] Trial 6 finished with value: 0.7989163154726069 and parameters: {'C': 0.03198407580533356, 'solver': 'sag'}. Best is trial 0 with value: 0.8603251053582179.
/remote-home/cs_acmis_xyt/dsAgent/development/workspace/20250902-120218/05_obesity_CVD_risk/train.py:30: FutureWarning: suggest_loguniform has been deprecated in v3.0.0. This feature will be removed in v6.0.0. See https://github.com/optuna/optuna/releases/tag/v3.0.0. Use suggest_float(..., log=True) instead.
  C = trial.suggest_loguniform('C', 1e-4, 1e4)
/remote-home/cs_acmis_xyt/dsAgent/envs/lib/python3.10/site-packages/sklearn/linear_model/_logistic.py:465: ConvergenceWarning: lbfgs failed to converge (status=1):
STOP: TOTAL NO. OF ITERATIONS REACHED LIMIT.

Increase the number of iterations (max_iter) or scale the data as shown in:
    https://scikit-learn.org/stable/modules/preprocessing.html
Please also refer to the documentation for alternative solver options:
    https://scikit-learn.org/stable/modules/linear_model.html#logistic-regression
  n_iter_i = _check_optimize_result(
[I 2025-09-03 09:31:41,609] Trial 7 finished with value: 0.8591210114388922 and parameters: {'C': 441.78380746060924, 'solver': 'lbfgs'}. Best is trial 0 with value: 0.8603251053582179.
/remote-home/cs_acmis_xyt/dsAgent/development/workspace/20250902-120218/05_obesity_CVD_risk/train.py:30: FutureWarning: suggest_loguniform has been deprecated in v3.0.0. This feature will be removed in v6.0.0. See https://github.com/optuna/optuna/releases/tag/v3.0.0. Use suggest_float(..., log=True) instead.
  C = trial.suggest_loguniform('C', 1e-4, 1e4)
[I 2025-09-03 09:31:42,036] Trial 8 finished with value: 0.8482841661649608 and parameters: {'C': 0.3094901190325425, 'solver': 'sag'}. Best is trial 0 with value: 0.8603251053582179.
/remote-home/cs_acmis_xyt/dsAgent/development/workspace/20250902-120218/05_obesity_CVD_risk/train.py:30: FutureWarning: suggest_loguniform has been deprecated in v3.0.0. This feature will be removed in v6.0.0. See https://github.com/optuna/optuna/releases/tag/v3.0.0. Use suggest_float(..., log=True) instead.
  C = trial.suggest_loguniform('C', 1e-4, 1e4)
[I 2025-09-03 09:31:42,180] Trial 9 finished with value: 0.8091511137868754 and parameters: {'C': 0.04998903273672448, 'solver': 'lbfgs'}. Best is trial 0 with value: 0.8603251053582179.
/remote-home/cs_acmis_xyt/dsAgent/development/workspace/20250902-120218/05_obesity_CVD_risk/train.py:30: FutureWarning: suggest_loguniform has been deprecated in v3.0.0. This feature will be removed in v6.0.0. See https://github.com/optuna/optuna/releases/tag/v3.0.0. Use suggest_float(..., log=True) instead.
  C = trial.suggest_loguniform('C', 1e-4, 1e4)
[I 2025-09-03 09:31:42,317] Trial 10 finished with value: 0.5839855508729681 and parameters: {'C': 0.00010354166495460634, 'solver': 'liblinear'}. Best is trial 0 with value: 0.8603251053582179.
/remote-home/cs_acmis_xyt/dsAgent/development/workspace/20250902-120218/05_obesity_CVD_risk/train.py:30: FutureWarning: suggest_loguniform has been deprecated in v3.0.0. This feature will be removed in v6.0.0. See https://github.com/optuna/optuna/releases/tag/v3.0.0. Use suggest_float(..., log=True) instead.
  C = trial.suggest_loguniform('C', 1e-4, 1e4)
/remote-home/cs_acmis_xyt/dsAgent/envs/lib/python3.10/site-packages/sklearn/linear_model/_sag.py:348: ConvergenceWarning: The max_iter was reached which means the coef_ did not converge
  warnings.warn(
[I 2025-09-03 09:31:43,224] Trial 11 finished with value: 0.8603251053582179 and parameters: {'C': 8760.963139208203, 'solver': 'sag'}. Best is trial 0 with value: 0.8603251053582179.
/remote-home/cs_acmis_xyt/dsAgent/development/workspace/20250902-120218/05_obesity_CVD_risk/train.py:30: FutureWarning: suggest_loguniform has been deprecated in v3.0.0. This feature will be removed in v6.0.0. See https://github.com/optuna/optuna/releases/tag/v3.0.0. Use suggest_float(..., log=True) instead.
  C = trial.suggest_loguniform('C', 1e-4, 1e4)
/remote-home/cs_acmis_xyt/dsAgent/envs/lib/python3.10/site-packages/sklearn/linear_model/_sag.py:348: ConvergenceWarning: The max_iter was reached which means the coef_ did not converge
  warnings.warn(
[I 2025-09-03 09:31:44,136] Trial 12 finished with value: 0.8603251053582179 and parameters: {'C': 9174.834552989389, 'solver': 'sag'}. Best is trial 0 with value: 0.8603251053582179.
/remote-home/cs_acmis_xyt/dsAgent/development/workspace/20250902-120218/05_obesity_CVD_risk/train.py:30: FutureWarning: suggest_loguniform has been deprecated in v3.0.0. This feature will be removed in v6.0.0. See https://github.com/optuna/optuna/releases/tag/v3.0.0. Use suggest_float(..., log=True) instead.
  C = trial.suggest_loguniform('C', 1e-4, 1e4)
/remote-home/cs_acmis_xyt/dsAgent/envs/lib/python3.10/site-packages/sklearn/linear_model/_sag.py:348: ConvergenceWarning: The max_iter was reached which means the coef_ did not converge
  warnings.warn(
[I 2025-09-03 09:31:45,043] Trial 13 finished with value: 0.8603251053582179 and parameters: {'C': 27.854604522372995, 'solver': 'sag'}. Best is trial 0 with value: 0.8603251053582179.
/remote-home/cs_acmis_xyt/dsAgent/development/workspace/20250902-120218/05_obesity_CVD_risk/train.py:30: FutureWarning: suggest_loguniform has been deprecated in v3.0.0. This feature will be removed in v6.0.0. See https://github.com/optuna/optuna/releases/tag/v3.0.0. Use suggest_float(..., log=True) instead.
  C = trial.suggest_loguniform('C', 1e-4, 1e4)
[I 2025-09-03 09:31:45,765] Trial 14 finished with value: 0.7507525586995786 and parameters: {'C': 113.48210055325093, 'solver': 'liblinear'}. Best is trial 0 with value: 0.8603251053582179.
/remote-home/cs_acmis_xyt/dsAgent/development/workspace/20250902-120218/05_obesity_CVD_risk/train.py:30: FutureWarning: suggest_loguniform has been deprecated in v3.0.0. This feature will be removed in v6.0.0. See https://github.com/optuna/optuna/releases/tag/v3.0.0. Use suggest_float(..., log=True) instead.
  C = trial.suggest_loguniform('C', 1e-4, 1e4)
/remote-home/cs_acmis_xyt/dsAgent/envs/lib/python3.10/site-packages/sklearn/linear_model/_sag.py:348: ConvergenceWarning: The max_iter was reached which means the coef_ did not converge
  warnings.warn(
[I 2025-09-03 09:31:46,722] Trial 15 finished with value: 0.8597230583985551 and parameters: {'C': 1414.5575342687057, 'solver': 'saga'}. Best is trial 0 with value: 0.8603251053582179.
/remote-home/cs_acmis_xyt/dsAgent/development/workspace/20250902-120218/05_obesity_CVD_risk/train.py:30: FutureWarning: suggest_loguniform has been deprecated in v3.0.0. This feature will be removed in v6.0.0. See https://github.com/optuna/optuna/releases/tag/v3.0.0. Use suggest_float(..., log=True) instead.
  C = trial.suggest_loguniform('C', 1e-4, 1e4)
