[I 2025-09-03 09:31:47,317] Trial 16 finished with value: 0.8555087296809151 and parameters: {'C': 1.2229634233459006, 'solver': 'sag'}. Best is trial 0 with value: 0.8603251053582179.
/remote-home/cs_acmis_xyt/dsAgent/development/workspace/20250902-120218/05_obesity_CVD_risk/train.py:30: FutureWarning: suggest_loguniform has been deprecated in v3.0.0. This feature will be removed in v6.0.0. See https://github.com/optuna/optuna/releases/tag/v3.0.0. Use suggest_float(..., log=True) instead.
  C = trial.suggest_loguniform('C', 1e-4, 1e4)
[I 2025-09-03 09:31:47,455] Trial 17 finished with value: 0.6484045755568935 and parameters: {'C': 0.0006378823141599856, 'solver': 'sag'}. Best is trial 0 with value: 0.8603251053582179.
/remote-home/cs_acmis_xyt/dsAgent/development/workspace/20250902-120218/05_obesity_CVD_risk/train.py:30: FutureWarning: suggest_loguniform has been deprecated in v3.0.0. This feature will be removed in v6.0.0. See https://github.com/optuna/optuna/releases/tag/v3.0.0. Use suggest_float(..., log=True) instead.
  C = trial.suggest_loguniform('C', 1e-4, 1e4)
/remote-home/cs_acmis_xyt/dsAgent/envs/lib/python3.10/site-packages/sklearn/linear_model/_sag.py:348: ConvergenceWarning: The max_iter was reached which means the coef_ did not converge
  warnings.warn(
[I 2025-09-03 09:31:48,356] Trial 18 finished with value: 0.8603251053582179 and parameters: {'C': 38.01709575299604, 'solver': 'sag'}. Best is trial 0 with value: 0.8603251053582179.
/remote-home/cs_acmis_xyt/dsAgent/development/workspace/20250902-120218/05_obesity_CVD_risk/train.py:30: FutureWarning: suggest_loguniform has been deprecated in v3.0.0. This feature will be removed in v6.0.0. See https://github.com/optuna/optuna/releases/tag/v3.0.0. Use suggest_float(..., log=True) instead.
  C = trial.suggest_loguniform('C', 1e-4, 1e4)
[I 2025-09-03 09:31:48,888] Trial 19 finished with value: 0.7483443708609272 and parameters: {'C': 2.27541345800726, 'solver': 'liblinear'}. Best is trial 0 with value: 0.8603251053582179.
/remote-home/cs_acmis_xyt/dsAgent/development/workspace/20250902-120218/05_obesity_CVD_risk/train.py:30: FutureWarning: suggest_loguniform has been deprecated in v3.0.0. This feature will be removed in v6.0.0. See https://github.com/optuna/optuna/releases/tag/v3.0.0. Use suggest_float(..., log=True) instead.
  C = trial.suggest_loguniform('C', 1e-4, 1e4)
/remote-home/cs_acmis_xyt/dsAgent/envs/lib/python3.10/site-packages/sklearn/linear_model/_sag.py:348: ConvergenceWarning: The max_iter was reached which means the coef_ did not converge
  warnings.warn(
[I 2025-09-03 09:31:49,842] Trial 20 finished with value: 0.8597230583985551 and parameters: {'C': 1970.1656408137455, 'solver': 'saga'}. Best is trial 0 with value: 0.8603251053582179.
/remote-home/cs_acmis_xyt/dsAgent/development/workspace/20250902-120218/05_obesity_CVD_risk/train.py:30: FutureWarning: suggest_loguniform has been deprecated in v3.0.0. This feature will be removed in v6.0.0. See https://github.com/optuna/optuna/releases/tag/v3.0.0. Use suggest_float(..., log=True) instead.
  C = trial.suggest_loguniform('C', 1e-4, 1e4)
[I 2025-09-03 09:31:50,313] Trial 21 finished with value: 0.8609271523178808 and parameters: {'C': 1134.1522205662404, 'solver': 'newton-cg'}. Best is trial 21 with value: 0.8609271523178808.
/remote-home/cs_acmis_xyt/dsAgent/development/workspace/20250902-120218/05_obesity_CVD_risk/train.py:30: FutureWarning: suggest_loguniform has been deprecated in v3.0.0. This feature will be removed in v6.0.0. See https://github.com/optuna/optuna/releases/tag/v3.0.0. Use suggest_float(..., log=True) instead.
  C = trial.suggest_loguniform('C', 1e-4, 1e4)
[I 2025-09-03 09:31:50,780] Trial 22 finished with value: 0.8603251053582179 and parameters: {'C': 158.27499552408727, 'solver': 'newton-cg'}. Best is trial 21 with value: 0.8609271523178808.
/remote-home/cs_acmis_xyt/dsAgent/development/workspace/20250902-120218/05_obesity_CVD_risk/train.py:30: FutureWarning: suggest_loguniform has been deprecated in v3.0.0. This feature will be removed in v6.0.0. See https://github.com/optuna/optuna/releases/tag/v3.0.0. Use suggest_float(..., log=True) instead.
  C = trial.suggest_loguniform('C', 1e-4, 1e4)
[I 2025-09-03 09:31:51,242] Trial 23 finished with value: 0.8603251053582179 and parameters: {'C': 2377.884032396913, 'solver': 'newton-cg'}. Best is trial 21 with value: 0.8609271523178808.
/remote-home/cs_acmis_xyt/dsAgent/development/workspace/20250902-120218/05_obesity_CVD_risk/train.py:30: FutureWarning: suggest_loguniform has been deprecated in v3.0.0. This feature will be removed in v6.0.0. See https://github.com/optuna/optuna/releases/tag/v3.0.0. Use suggest_float(..., log=True) instead.
  C = trial.suggest_loguniform('C', 1e-4, 1e4)
[I 2025-09-03 09:31:51,699] Trial 24 finished with value: 0.8603251053582179 and parameters: {'C': 512.590224404218, 'solver': 'newton-cg'}. Best is trial 21 with value: 0.8609271523178808.
/remote-home/cs_acmis_xyt/dsAgent/development/workspace/20250902-120218/05_obesity_CVD_risk/train.py:30: FutureWarning: suggest_loguniform has been deprecated in v3.0.0. This feature will be removed in v6.0.0. See https://github.com/optuna/optuna/releases/tag/v3.0.0. Use suggest_float(..., log=True) instead.
  C = trial.suggest_loguniform('C', 1e-4, 1e4)
[I 2025-09-03 09:31:52,167] Trial 25 finished with value: 0.8609271523178808 and parameters: {'C': 4456.046976721186, 'solver': 'newton-cg'}. Best is trial 21 with value: 0.8609271523178808.
/remote-home/cs_acmis_xyt/dsAgent/development/workspace/20250902-120218/05_obesity_CVD_risk/train.py:30: FutureWarning: suggest_loguniform has been deprecated in v3.0.0. This feature will be removed in v6.0.0. See https://github.com/optuna/optuna/releases/tag/v3.0.0. Use suggest_float(..., log=True) instead.
  C = trial.suggest_loguniform('C', 1e-4, 1e4)
[I 2025-09-03 09:31:52,633] Trial 26 finished with value: 0.8609271523178808 and parameters: {'C': 9059.43165940299, 'solver': 'newton-cg'}. Best is trial 21 with value: 0.8609271523178808.
/remote-home/cs_acmis_xyt/dsAgent/development/workspace/20250902-120218/05_obesity_CVD_risk/train.py:30: FutureWarning: suggest_loguniform has been deprecated in v3.0.0. This feature will be removed in v6.0.0. See https://github.com/optuna/optuna/releases/tag/v3.0.0. Use suggest_float(..., log=True) instead.
  C = trial.suggest_loguniform('C', 1e-4, 1e4)
[I 2025-09-03 09:31:53,094] Trial 27 finished with value: 0.8603251053582179 and parameters: {'C': 8859.876679820292, 'solver': 'newton-cg'}. Best is trial 21 with value: 0.8609271523178808.
/remote-home/cs_acmis_xyt/dsAgent/development/workspace/20250902-120218/05_obesity_CVD_risk/train.py:30: FutureWarning: suggest_loguniform has been deprecated in v3.0.0. This feature will be removed in v6.0.0. See https://github.com/optuna/optuna/releases/tag/v3.0.0. Use suggest_float(..., log=True) instead.
  C = trial.suggest_loguniform('C', 1e-4, 1e4)
[I 2025-09-03 09:31:53,563] Trial 28 finished with value: 0.8603251053582179 and parameters: {'C': 610.4557877339832, 'solver': 'newton-cg'}. Best is trial 21 with value: 0.8609271523178808.
/remote-home/cs_acmis_xyt/dsAgent/development/workspace/20250902-120218/05_obesity_CVD_risk/train.py:30: FutureWarning: suggest_loguniform has been deprecated in v3.0.0. This feature will be removed in v6.0.0. See https://github.com/optuna/optuna/releases/tag/v3.0.0. Use suggest_float(..., log=True) instead.
  C = trial.suggest_loguniform('C', 1e-4, 1e4)
[I 2025-09-03 09:31:54,034] Trial 29 finished with value: 0.8609271523178808 and parameters: {'C': 5640.75099054633, 'solver': 'newton-cg'}. Best is trial 21 with value: 0.8609271523178808.
/remote-home/cs_acmis_xyt/dsAgent/development/workspace/20250902-120218/05_obesity_CVD_risk/train.py:30: FutureWarning: suggest_loguniform has been deprecated in v3.0.0. This feature will be removed in v6.0.0. See https://github.com/optuna/optuna/releases/tag/v3.0.0. Use suggest_float(..., log=True) instead.
  C = trial.suggest_loguniform('C', 1e-4, 1e4)
[I 2025-09-03 09:31:54,501] Trial 30 finished with value: 0.8609271523178808 and parameters: {'C': 2536.908433496177, 'solver': 'newton-cg'}. Best is trial 21 with value: 0.8609271523178808.
/remote-home/cs_acmis_xyt/dsAgent/development/workspace/20250902-120218/05_obesity_CVD_risk/train.py:30: FutureWarning: suggest_loguniform has been deprecated in v3.0.0. This feature will be removed in v6.0.0. See https://github.com/optuna/optuna/releases/tag/v3.0.0. Use suggest_float(..., log=True) instead.
  C = trial.suggest_loguniform('C', 1e-4, 1e4)
[I 2025-09-03 09:31:54,965] Trial 31 finished with value: 0.8603251053582179 and parameters: {'C': 3842.055147957561, 'solver': 'newton-cg'}. Best is trial 21 with value: 0.8609271523178808.
/remote-home/cs_acmis_xyt/dsAgent/development/workspace/20250902-120218/05_obesity_CVD_risk/train.py:30: FutureWarning: suggest_loguniform has been deprecated in v3.0.0. This feature will be removed in v6.0.0. See https://github.com/optuna/optuna/releases/tag/v3.0.0. Use suggest_float(..., log=True) instead.
  C = trial.suggest_loguniform('C', 1e-4, 1e4)
[I 2025-09-03 09:31:55,440] Trial 32 finished with value: 0.8603251053582179 and parameters: {'C': 255.68447766526694, 'solver': 'newton-cg'}. Best is trial 21 with value: 0.8609271523178808.
/remote-home/cs_acmis_xyt/dsAgent/development/workspace/20250902-120218/05_obesity_CVD_risk/train.py:30: FutureWarning: suggest_loguniform has been deprecated in v3.0.0. This feature will be removed in v6.0.0. See https://github.com/optuna/optuna/releases/tag/v3.0.0. Use suggest_float(..., log=True) instead.
  C = trial.suggest_loguniform('C', 1e-4, 1e4)
[I 2025-09-03 09:31:55,909] Trial 33 finished with value: 0.8609271523178808 and parameters: {'C': 4440.612243265714, 'solver': 'newton-cg'}. Best is trial 21 with value: 0.8609271523178808.
/remote-home/cs_acmis_xyt/dsAgent/development/workspace/20250902-120218/05_obesity_CVD_risk/train.py:30: FutureWarning: suggest_loguniform has been deprecated in v3.0.0. This feature will be removed in v6.0.0. See https://github.com/optuna/optuna/releases/tag/v3.0.0. Use suggest_float(..., log=True) instead.
  C = trial.suggest_loguniform('C', 1e-4, 1e4)
[I 2025-09-03 09:31:56,376] Trial 34 finished with value: 0.8609271523178808 and parameters: {'C': 907.6287588574147, 'solver': 'newton-cg'}. Best is trial 21 with value: 0.8609271523178808.
/remote-home/cs_acmis_xyt/dsAgent/development/workspace/20250902-120218/05_obesity_CVD_risk/train.py:30: FutureWarning: suggest_loguniform has been deprecated in v3.0.0. This feature will be removed in v6.0.0. See https://github.com/optuna/optuna/releases/tag/v3.0.0. Use suggest_float(..., log=True) instead.
  C = trial.suggest_loguniform('C', 1e-4, 1e4)
[I 2025-09-03 09:31:56,850] Trial 35 finished with value: 0.8603251053582179 and parameters: {'C': 158.80982237518577, 'solver': 'newton-cg'}. Best is trial 21 with value: 0.8609271523178808.
/remote-home/cs_acmis_xyt/dsAgent/development/workspace/20250902-120218/05_obesity_CVD_risk/train.py:30: FutureWarning: suggest_loguniform has been deprecated in v3.0.0. This feature will be removed in v6.0.0. See https://github.com/optuna/optuna/releases/tag/v3.0.0. Use suggest_float(..., log=True) instead.
  C = trial.suggest_loguniform('C', 1e-4, 1e4)
[I 2025-09-03 09:31:57,314] Trial 36 finished with value: 0.8603251053582179 and parameters: {'C': 3998.292123396444, 'solver': 'newton-cg'}. Best is trial 21 with value: 0.8609271523178808.
/remote-home/cs_acmis_xyt/dsAgent/development/workspace/20250902-120218/05_obesity_CVD_risk/train.py:30: FutureWarning: suggest_loguniform has been deprecated in v3.0.0. This feature will be removed in v6.0.0. See https://github.com/optuna/optuna/releases/tag/v3.0.0. Use suggest_float(..., log=True) instead.
  C = trial.suggest_loguniform('C', 1e-4, 1e4)
/remote-home/cs_acmis_xyt/dsAgent/envs/lib/python3.10/site-packages/sklearn/linear_model/_sag.py:348: ConvergenceWarning: The max_iter was reached which means the coef_ did not converge
  warnings.warn(
[I 2025-09-03 09:31:58,300] Trial 37 finished with value: 0.8597230583985551 and parameters: {'C': 929.7666416149447, 'solver': 'saga'}. Best is trial 21 with value: 0.8609271523178808.
/remote-home/cs_acmis_xyt/dsAgent/development/workspace/20250902-120218/05_obesity_CVD_risk/train.py:30: FutureWarning: suggest_loguniform has been deprecated in v3.0.0. This feature will be removed in v6.0.0. See https://github.com/optuna/optuna/releases/tag/v3.0.0. Use suggest_float(..., log=True) instead.
  C = trial.suggest_loguniform('C', 1e-4, 1e4)
[I 2025-09-03 09:31:58,775] Trial 38 finished with value: 0.8603251053582179 and parameters: {'C': 81.86978627612525, 'solver': 'newton-cg'}. Best is trial 21 with value: 0.8609271523178808.
/remote-home/cs_acmis_xyt/dsAgent/development/workspace/20250902-120218/05_obesity_CVD_risk/train.py:30: FutureWarning: suggest_loguniform has been deprecated in v3.0.0. This feature will be removed in v6.0.0. See https://github.com/optuna/optuna/releases/tag/v3.0.0. Use suggest_float(..., log=True) instead.
  C = trial.suggest_loguniform('C', 1e-4, 1e4)
/remote-home/cs_acmis_xyt/dsAgent/envs/lib/python3.10/site-packages/sklearn/linear_model/_logistic.py:465: ConvergenceWarning: lbfgs failed to converge (status=1):
STOP: TOTAL NO. OF ITERATIONS REACHED LIMIT.

Increase the number of iterations (max_iter) or scale the data as shown in:
    https://scikit-learn.org/stable/modules/preprocessing.html
Please also refer to the documentation for alternative solver options:
    https://scikit-learn.org/stable/modules/linear_model.html#logistic-regression
  n_iter_i = _check_optimize_result(
[I 2025-09-03 09:31:59,049] Trial 39 finished with value: 0.8579169175195666 and parameters: {'C': 8.69492547661776, 'solver': 'lbfgs'}. Best is trial 21 with value: 0.8609271523178808.
/remote-home/cs_acmis_xyt/dsAgent/development/workspace/20250902-120218/05_obesity_CVD_risk/train.py:30: FutureWarning: suggest_loguniform has been deprecated in v3.0.0. This feature will be removed in v6.0.0. See https://github.com/optuna/optuna/releases/tag/v3.0.0. Use suggest_float(..., log=True) instead.
  C = trial.suggest_loguniform('C', 1e-4, 1e4)
[I 2025-09-03 09:31:59,515] Trial 40 finished with value: 0.8603251053582179 and parameters: {'C': 399.62595439998506, 'solver': 'newton-cg'}. Best is trial 21 with value: 0.8609271523178808.
/remote-home/cs_acmis_xyt/dsAgent/development/workspace/20250902-120218/05_obesity_CVD_risk/train.py:30: FutureWarning: suggest_loguniform has been deprecated in v3.0.0. This feature will be removed in v6.0.0. See https://github.com/optuna/optuna/releases/tag/v3.0.0. Use suggest_float(..., log=True) instead.
  C = trial.suggest_loguniform('C', 1e-4, 1e4)
[I 2025-09-03 09:31:59,998] Trial 41 finished with value: 0.8609271523178808 and parameters: {'C': 2368.172316934268, 'solver': 'newton-cg'}. Best is trial 21 with value: 0.8609271523178808.
/remote-home/cs_acmis_xyt/dsAgent/development/workspace/20250902-120218/05_obesity_CVD_risk/train.py:30: FutureWarning: suggest_loguniform has been deprecated in v3.0.0. This feature will be removed in v6.0.0. See https://github.com/optuna/optuna/releases/tag/v3.0.0. Use suggest_float(..., log=True) instead.
  C = trial.suggest_loguniform('C', 1e-4, 1e4)
[I 2025-09-03 09:32:00,476] Trial 42 finished with value: 0.8603251053582179 and parameters: {'C': 9256.04569250163, 'solver': 'newton-cg'}. Best is trial 21 with value: 0.8609271523178808.
/remote-home/cs_acmis_xyt/dsAgent/development/workspace/20250902-120218/05_obesity_CVD_risk/train.py:30: FutureWarning: suggest_loguniform has been deprecated in v3.0.0. This feature will be removed in v6.0.0. See https://github.com/optuna/optuna/releases/tag/v3.0.0. Use suggest_float(..., log=True) instead.
  C = trial.suggest_loguniform('C', 1e-4, 1e4)
[I 2025-09-03 09:32:00,954] Trial 43 finished with value: 0.8609271523178808 and parameters: {'C': 1278.72558862819, 'solver': 'newton-cg'}. Best is trial 21 with value: 0.8609271523178808.
/remote-home/cs_acmis_xyt/dsAgent/development/workspace/20250902-120218/05_obesity_CVD_risk/train.py:30: FutureWarning: suggest_loguniform has been deprecated in v3.0.0. This feature will be removed in v6.0.0. See https://github.com/optuna/optuna/releases/tag/v3.0.0. Use suggest_float(..., log=True) instead.
  C = trial.suggest_loguniform('C', 1e-4, 1e4)
[I 2025-09-03 09:32:01,433] Trial 44 finished with value: 0.8603251053582179 and parameters: {'C': 3694.6882807964007, 'solver': 'newton-cg'}. Best is trial 21 with value: 0.8609271523178808.
/remote-home/cs_acmis_xyt/dsAgent/development/workspace/20250902-120218/05_obesity_CVD_risk/train.py:30: FutureWarning: suggest_loguniform has been deprecated in v3.0.0. This feature will be removed in v6.0.0. See https://github.com/optuna/optuna/releases/tag/v3.0.0. Use suggest_float(..., log=True) instead.
  C = trial.suggest_loguniform('C', 1e-4, 1e4)
[I 2025-09-03 09:32:01,632] Trial 45 finished with value: 0.8332329921733895 and parameters: {'C': 0.1252512686642481, 'solver': 'lbfgs'}. Best is trial 21 with value: 0.8609271523178808.
/remote-home/cs_acmis_xyt/dsAgent/development/workspace/20250902-120218/05_obesity_CVD_risk/train.py:30: FutureWarning: suggest_loguniform has been deprecated in v3.0.0. This feature will be removed in v6.0.0. See https://github.com/optuna/optuna/releases/tag/v3.0.0. Use suggest_float(..., log=True) instead.
  C = trial.suggest_loguniform('C', 1e-4, 1e4)
[I 2025-09-03 09:32:02,103] Trial 46 finished with value: 0.8603251053582179 and parameters: {'C': 4692.490795422937, 'solver': 'newton-cg'}. Best is trial 21 with value: 0.8609271523178808.
/remote-home/cs_acmis_xyt/dsAgent/development/workspace/20250902-120218/05_obesity_CVD_risk/train.py:30: FutureWarning: suggest_loguniform has been deprecated in v3.0.0. This feature will be removed in v6.0.0. See https://github.com/optuna/optuna/releases/tag/v3.0.0. Use suggest_float(..., log=True) instead.
  C = trial.suggest_loguniform('C', 1e-4, 1e4)
[I 2025-09-03 09:32:02,346] Trial 47 finished with value: 0.6369656833232992 and parameters: {'C': 0.0018797950843936271, 'solver': 'liblinear'}. Best is trial 21 with value: 0.8609271523178808.
/remote-home/cs_acmis_xyt/dsAgent/development/workspace/20250902-120218/05_obesity_CVD_risk/train.py:30: FutureWarning: suggest_loguniform has been deprecated in v3.0.0. This feature will be removed in v6.0.0. See https://github.com/optuna/optuna/releases/tag/v3.0.0. Use suggest_float(..., log=True) instead.
  C = trial.suggest_loguniform('C', 1e-4, 1e4)
[I 2025-09-03 09:32:02,798] Trial 48 finished with value: 0.8603251053582179 and parameters: {'C': 18.67970647843559, 'solver': 'newton-cg'}. Best is trial 21 with value: 0.8609271523178808.
/remote-home/cs_acmis_xyt/dsAgent/development/workspace/20250902-120218/05_obesity_CVD_risk/train.py:30: FutureWarning: suggest_loguniform has been deprecated in v3.0.0. This feature will be removed in v6.0.0. See https://github.com/optuna/optuna/releases/tag/v3.0.0. Use suggest_float(..., log=True) instead.
  C = trial.suggest_loguniform('C', 1e-4, 1e4)
/remote-home/cs_acmis_xyt/dsAgent/envs/lib/python3.10/site-packages/sklearn/linear_model/_sag.py:348: ConvergenceWarning: The max_iter was reached which means the coef_ did not converge
  warnings.warn(
